org,scraped_at,headline_1,headline_2,headline_3
https://www.aljazeera.com,2024-06-03 05:34:22.466369,"Israeli strikes on Gaza refugee camps, residential homes kill at least 22, https://www.aljazeera.com/news/liveblog/2024/6/3/israels-war-on-gaza-live-israeli-strike-on-gaza-refugee-camp-kills-four","Sheinbaum takes early lead in race to be Mexico’s first female president, https://www.aljazeera.com/news/liveblog/2024/6/3/mexico-election-2024-results-live-will-sheinbaum-win-the-presidency","South Africa’s Ramaphosa calls for unity after his ANC loses majority, https://www.aljazeera.com/news/2024/6/2/south-africas-ramaphosa-calls-for-unity-after-anc-loses-majority"
https://www.economist.com,2024-06-02 05:32:35.250562,"South Africa stands on the brink of salvation—or catastrophe, https://www.economist.com/leaders/2024/06/01/south-africa-stands-on-the-brink-of-salvation-or-catastrophe","The three women who will shape Europe, https://www.economist.com/leaders/2024/05/30/the-three-women-who-will-shape-europe","Exit polls point to a crushing victory for Narendra Modi, https://www.economist.com/asia/2024/06/01/exit-polls-point-to-a-crushing-victory-for-narendra-modi"
https://www.lemonde.fr/en/,2024-06-02 05:32:34.330000,"In Mexico, the Left is expected to remain in power, https://www.lemonde.fr/en/international/article/2024/06/02/in-mexico-the-left-is-expected-to-remain-in-power_6673431_4.html","Israel-Hamas war: Israeli far-right ministers threaten to quit if Biden ceasefire plan goes ahead, https://www.lemonde.fr/en/international/article/2024/06/01/israel-hamas-war-israeli-far-right-ministers-threaten-to-quit-if-biden-ceasefire-plan-goes-ahead_6673422_4.html","In the UK, Nigel Farage hopes to win back disappointed Conservatives, https://www.lemonde.fr/en/international/article/2024/06/02/in-the-uk-nigel-farage-hopes-to-win-back-disappointed-conservatives_6673433_4.html"
https://www.bbc.com,2024-06-02 05:32:33.552640,"China says its spacecraft lands on Moon's far side, https://www.bbc.com/news/articles/cxeejp0y2pjo","South Africa's ANC has to share power after election blow, https://www.bbc.com/news/articles/cyeek2xlgzzo","Israeli ministers threaten to quit over ceasefire plan, https://www.bbc.com/news/articles/cz55y6k0p5go"
https://www.aljazeera.com,2024-06-02 05:32:32.901094,"Egypt, Qatar, US urge Israel, Hamas to finalise Gaza truce deal, https://www.aljazeera.com/news/liveblog/2024/6/2/israels-war-on-gaza-live-mediators-urge-israel-hamas-to-finalise-truce","Modi magic: Why Indian exit polls predict record BJP win, https://www.aljazeera.com/news/2024/6/2/modi-magic-why-indian-exit-polls-predict-bjp-could-return-even-stronger","Israeli captive families call on government to accept Biden plan for Gaza, https://www.aljazeera.com/news/2024/6/1/israel-pounds-gaza-insists-on-hamas-destruction-as-us-presses-roadmap"
https://www.economist.com,2024-06-01 05:34:10.390394,"The undoing of Roe v Wade has created a mighty political movement, https://www.economist.com/briefing/2024/05/30/the-undoing-of-roe-v-wade-has-created-a-mighty-political-movement","New fronts are opening in the war against malaria, https://www.economist.com/middle-east-and-africa/2024/05/30/new-fronts-are-opening-in-the-war-against-malaria","Japan and South Korea are getting friendlier. At last, https://www.economist.com/leaders/2024/05/30/japan-and-south-korea-are-getting-friendlier-at-last"
https://www.lemonde.fr/en/,2024-06-01 05:34:09.430077,"French schools see anti-Semitism and racism expressed increasingly earlier: 'There are no longer any taboos', https://www.lemonde.fr/en/france/article/2024/06/01/french-schools-see-anti-semitism-and-racism-expressed-increasingly-earlier-there-are-no-longer-any-taboos_6673374_7.html","Hamas considers positively Israel's offer for a six-week ceasefire, https://www.lemonde.fr/en/international/article/2024/05/31/israel-offers-new-roadmap-to-end-gaza-war-says-biden_6673340_4.html","Mexico hit with relentless, deadly heatwave, https://www.lemonde.fr/en/environment/article/2024/05/31/mexico-hit-with-relentless-deadly-heatwave_6673356_114.html"
https://www.bbc.com,2024-06-01 05:34:08.656456,"Attack Trump verdict or be exiled - a new test for Republicans, https://www.bbc.com/news/articles/ck77xpkr0x8o","Biden: 'Reckless' for Trump to call trial rigged, https://www.bbc.com/news/articles/cd11k751glno","Biden unveils Israeli proposal to end Gaza war , https://www.bbc.com/news/articles/cw8860gn1nwo"
https://www.aljazeera.com,2024-06-01 05:34:07.973731,"Hopes revived for a halt to Israel’s war on Gaza as new truce deal emerges, https://www.aljazeera.com/news/liveblog/2024/6/1/israels-war-on-gaza-live-rafah-apocalyptic-after-ground-invasion","Zuma big election ‘winner’ as South Africa heads for coalition government, https://www.aljazeera.com/news/2024/5/31/zuma-big-election-winner-as-south-africa-heads-for-coalition-government","India votes in final phase of giant election as Modi seeks rare third term, https://www.aljazeera.com/news/liveblog/2024/6/1/india-election-2024-live-news-giant-lok-sabha-polls-enter-final-phase"
https://www.economist.com,2024-05-30 05:32:26.634388,"Who is responsible for feeding Gaza?, https://www.economist.com/middle-east-and-africa/2024/05/29/who-is-responsible-for-feeding-gaza","Incompetence or opacity: the choice facing British voters, https://www.economist.com/leaders/2024/05/29/incompetence-or-opacity-the-choice-facing-british-voters","Can Elon Musk’s xAI take on OpenAI?, https://www.economist.com/business/2024/05/29/can-elon-musks-xai-take-on-openai"
https://www.lemonde.fr/en/,2024-05-30 05:32:25.679939,"Sale of part of Renault's art collection at Christie's ignites controversy, https://www.lemonde.fr/en/culture/article/2024/05/30/sale-of-part-of-renault-s-art-collection-at-christie-s-ignites-controversy_6673101_30.html","North Korea's latest satellites rely on Russian technical assistance, experts say, https://www.lemonde.fr/en/international/article/2024/05/29/north-korea-s-latest-satellites-rely-on-russian-technical-assistance-experts-say_6673068_4.html","Russian taxes rise to fund war effort, https://www.lemonde.fr/en/economy/article/2024/05/30/russian-taxes-rise-to-fund-war-effort_6673089_19.html"
https://www.bbc.com,2024-05-30 05:32:25.003754,"After strict instructions, Trump jury begins deliberations, https://www.bbc.com/news/articles/c033m2qdm0no","Alito rejects call to skip Trump cases after flags row, https://www.bbc.com/news/articles/cnll5z5yendo","HK court convicts 14 democracy activists in biggest security case, https://www.bbc.com/news/live/world-asia-69051803"
https://www.aljazeera.com,2024-05-30 05:32:24.332566,"Street battles rage in Rafah as people flee Israeli troops, drone attacks, https://www.aljazeera.com/news/liveblog/2024/5/30/israels-war-on-gaza-live-no-safe-shelter-as-dozens-killed-in-rafah","Hong Kong court finds 14 of 16 democracy activists guilty of subversion, https://www.aljazeera.com/news/2024/5/30/hong-kong-court-finds-14-of-16-democracy-activists-guilty-of-subversion","North Korea fires volley of short-range ballistic missiles, https://www.aljazeera.com/news/2024/5/30/north-korea-fires-volley-of-short-range-ballistic-missiles"
https://www.economist.com,2024-05-29 05:33:56.526323,"Why today’s election in South Africa is its most important since 1994, https://www.economist.com/briefing/2024/05/23/why-this-is-south-africas-most-important-election-since-1994","What are America’s Libertarians for?, https://www.economist.com/united-states/2024/05/28/what-are-americas-libertarians-for","Japanese businesses are trapped between America and China, https://www.economist.com/business/2024/05/28/japanese-businesses-are-trapped-between-america-and-china"
https://www.lemonde.fr/en/,2024-05-29 05:33:55.265890,"Yahya Sinwar, the elusive Hamas leader, https://www.lemonde.fr/en/international/article/2024/05/29/yahya-sinwar-the-elusive-hamas-leader_6672967_4.html","Amnesty International report shows executions worldwide last year were the highest since 2015, https://www.lemonde.fr/en/international/article/2024/05/29/an-amnesty-international-report-shows-executions-worldwide-last-year-were-the-highest-since-2015_6672964_4.html","'ChatXiPT, the Chinese artificial intelligence that reflects Xi Jinping Thought', https://www.lemonde.fr/en/opinion/article/2024/05/29/chatxipt-the-chinese-artificial-intelligence-that-reflects-xi-jinping-thought_6672957_23.html"
https://www.bbc.com,2024-05-29 05:33:54.066766,"Growing up under fire: Ukraine’s children adapt to survive Russia's invasion, https://www.bbc.com/news/articles/c4nn0jdejw8o","Trump lawyer tells jury Cohen is 'greatest liar of all time' , https://www.bbc.com/news/articles/c6ppz2l16n7o","Israel's operation in Rafah doesn't cross US red lines - White House, https://www.bbc.com/news/articles/cv22pl9p212o"
https://www.aljazeera.com,2024-05-29 05:33:53.294290,"Israeli tanks in Rafah city as new deadly strike targets Gaza civilians, https://www.aljazeera.com/news/liveblog/2024/5/29/israels-war-on-gaza-live-tent-cities-attacked-as-tanks-roll-into-rafah","South Africa goes to the polls in key test for ANC’s grip on power, https://www.aljazeera.com/news/liveblog/2024/5/29/south-africa-elections-2024-live-news-anc-ramaphosa-face-key-vote","Closing arguments wrap up in Trump’s hush-money trial: Here’s what to know, https://www.aljazeera.com/news/2024/5/29/closing-arguments-wrap-up-in-trumps-hush-money-trial-heres-what-to-know"
https://www.economist.com,2024-05-28 05:32:33.264385,"Is America giving Narendra Modi an easy ride?, https://www.economist.com/asia/2024/05/27/is-america-giving-narendra-modi-an-easy-ride","Texas’s Republicans eat their own, https://www.economist.com/united-states/2024/05/27/texass-republicans-eat-their-own","OPEC heavyweights are cheating on their targets, https://www.economist.com/finance-and-economics/2024/05/27/opec-heavyweights-are-cheating-on-their-targets"
https://www.lemonde.fr/en/,2024-05-28 05:32:32.259678,"For sale: Kyiv's Hotel Ukraine, a €23.5 million property that could help fund the war effort, https://www.lemonde.fr/en/m-le-mag/article/2024/05/28/for-sale-kyiv-s-hotel-ukraine-a-23-5-million-property-that-could-help-fund-the-war-effort_6672863_117.html","World reacts with horror after massacre in Rafah, emergency UN meeting called, https://www.lemonde.fr/en/international/article/2024/05/28/world-reacts-with-horror-after-massacre-in-rafah-emergency-un-meeting-called_6672854_4.html","Dutch conservatives, architects of the rise of the far right, https://www.lemonde.fr/en/opinion/article/2024/05/28/dutch-conservatives-architects-of-the-rise-of-the-far-right_6672853_23.html"
https://www.bbc.com,2024-05-28 05:32:31.539698,"Netanyahu vows to continue war amid air strike condemnation, https://www.bbc.com/news/articles/c7228x974lxo","Luxury perfumes linked to child labour, BBC finds, https://www.bbc.com/news/world-middle-east-68172560","Jeremy Bowen: Ukraine faces its worst crisis since the war began, https://www.bbc.com/news/articles/c9xx15pe311o"
https://www.aljazeera.com,2024-05-28 05:32:30.808921,"Deaths mount in Rafah from Israeli strikes; world condemns camp ‘massacre’, https://www.aljazeera.com/news/liveblog/2024/5/28/israels-war-on-gaza-live-intense-israeli-artillery-shelling-across-rafah","‘Heinous massacre’: Israel’s attack on Rafah tent camp widely condemned, https://www.aljazeera.com/news/2024/5/27/heinous-massacre-israels-attacks-on-rafah-tent-camp-widely-condemned","Spain pledges 1 billion euros of military aid to Ukraine in 2024, https://www.aljazeera.com/news/2024/5/27/spain-pledges-1-billion-euros-of-military-aid-to-ukraine-in-2024"
https://www.economist.com,2024-05-27 05:33:06.028004,"Baby-boomers are loaded. Why are they so stingy?, https://www.economist.com/finance-and-economics/2024/05/26/baby-boomers-are-loaded-why-are-they-so-stingy","Fewer migrants are crossing America’s southern border, https://www.economist.com/united-states/2024/05/23/fewer-migrants-are-crossing-americas-southern-border","Sir Keir Starmer meets the public. Sort of, https://www.economist.com/britain/2024/05/26/sir-keir-starmer-meets-the-public-sort-of"
https://www.lemonde.fr/en/,2024-05-27 05:33:05.005228,"Rafael Nadal, king of clay, returns to French Open for last dance, https://www.lemonde.fr/en/sports/article/2024/05/27/rafael-nadal-king-of-clay-returns-to-french-open-for-last-dance_6672771_9.html","The Seine and other European rivers contaminated by a 'forever chemical' that has gone under the radar, https://www.lemonde.fr/en/environment/article/2024/05/27/the-seine-and-other-european-rivers-contaminated-by-a-forever-chemical-that-has-gone-under-the-radar_6672781_114.html","Palestinians call airstrike that kills 35 in Rafah 'horrific massacre;' Israeli army says it struck a Hamas compound, https://www.lemonde.fr/en/international/article/2024/05/26/palestinian-medics-say-israeli-airstrike-kills-22-in-gaza-s-rafah_6672753_4.html"
https://www.bbc.com,2024-05-27 05:33:04.301157,"How settlers took revenge for a murder in the West Bank, https://www.bbc.com/news/world-middle-east-69052857","Priced out of homeownership - 'It makes me want to throw up', https://www.bbc.com/news/articles/cmj66r4lvzzo","Israeli strike hits Rafah area after Hamas barrage, https://www.bbc.com/news/articles/c0kkqkngnedo"
https://www.aljazeera.com,2024-05-27 05:33:03.486601,"‘People burned alive’ as Israel attacks designated safe zone in Rafah, https://www.aljazeera.com/news/liveblog/2024/5/27/israels-war-on-gaza-live-news-35-killed-in-rafah-tent-bombings","At least 35 killed in Israeli strike on Rafah after Hamas rocket attacks, https://www.aljazeera.com/news/2024/5/27/dozens-killed-in-israeli-strike-on-rafah-following-hamas-rocket-attacks","North Korea plans to launch space satellite by June 4: Japan, https://www.aljazeera.com/news/2024/5/27/north-korea-plans-to-launch-space-satellite-by-june-4-japan"
https://www.economist.com,2024-05-26 05:32:28.562671,"How many people have died in Gaza?, https://www.economist.com/middle-east-and-africa/2024/05/23/how-many-people-have-died-in-gaza","Walmart’s latest product? Its customers, https://www.economist.com/business/2024/05/23/walmarts-latest-product-its-customers","Meet the man causing cracks in the antiquities trade, https://www.economist.com/culture/2024/05/23/meet-the-man-causing-cracks-in-the-antiquities-trade"
https://www.lemonde.fr/en/,2024-05-26 05:32:27.508457,"Cannes 2024: 'Anora' by American Sean Baker wins Palme d'Or, https://www.lemonde.fr/en/culture/article/2024/05/25/cannes-2024-anora-by-american-sean-baker-wins-palme-d-or_6672662_30.html","PSG wins the French Cup and completes the double in Mbappé's last game, https://www.lemonde.fr/en/sports/article/2024/05/25/psg-wins-the-french-cup-and-completes-the-double-in-mbappe-s-last-game_6672668_9.html","Presidential election in Lithuania under Russian pressure, https://www.lemonde.fr/en/international/article/2024/05/26/presidential-election-in-lithuania-under-russian-pressure_6672692_4.html"
https://www.bbc.com,2024-05-26 05:32:26.334093,"Meet the Peaky Blinders - Ukraine's drone squad defending Kharkiv, https://www.bbc.com/news/articles/cp0018dzg32o","As Trump trial hurtles towards verdict, are Americans paying attention?, https://www.bbc.com/news/articles/cv22mryvleko","How plans for ‘the day after’ could help end war in Gaza, https://www.bbc.com/news/world-middle-east-69059863"
https://www.aljazeera.com,2024-05-26 05:32:25.636985,"Hamas says it captured Israeli soldiers in ambush; Israel denies claim, https://www.aljazeera.com/news/liveblog/2024/5/26/israels-war-on-gaza-live-news-hamas-claims-capture-of-israeli-troops","Attacks kill four in Ukraine’s Kharkiv, three in Russia’s Belgorod, https://www.aljazeera.com/news/2024/5/25/russian-air-raids-kill-two-wound-dozens-in-ukraines-kharkiv","Hamas official rejects talk of new negotiations with Israel, https://www.aljazeera.com/news/2024/5/25/hamas-official-rejects-talk-of-new-negotiations-with-israel"
https://www.economist.com,2024-05-25 05:32:28.655057,"NATO’s boss wants to free Ukraine to strike hard inside Russia, https://www.economist.com/europe/2024/05/24/natos-boss-wants-to-free-ukraine-to-strike-hard-inside-russia","The ICJ orders restraint from Israel in Rafah, https://www.economist.com/middle-east-and-africa/2024/05/24/the-icj-orders-restraint-from-israel-in-rafah","Rural white voters in Wisconsin could decide America’s election, https://www.economist.com/interactive/united-states/2024/05/22/rural-white-voters-in-wisconsin-could-decide-americas-election"
https://www.lemonde.fr/en/,2024-05-25 05:32:27.505987,"Saint-Denis, cradle of rap and the French hip-hop movement, https://www.lemonde.fr/en/m-le-mag/article/2024/05/25/saint-denis-cradle-of-rap-and-the-french-hip-hop-movement_6672604_117.html","War in Ukraine: why Crimea remains Kyiv's priority, https://www.lemonde.fr/en/international/article/2024/05/25/war-in-ukraine-why-crimea-remains-kyiv-s-priority_6672599_4.html","'Under President Raisi, Iran's foreign and security policy became more aggressive.', https://www.lemonde.fr/en/opinion/article/2024/05/25/under-president-raisi-iran-s-foreign-and-security-policy-became-more-aggressive_6672595_23.html"
https://www.bbc.com,2024-05-25 05:32:26.601378,"'I just want what the white people have' - what happened to Cynthia's dream in South Africa, https://www.bbc.com/news/videos/c6pp7jynzxyo","Kenya police to arrive in Haiti in 'three weeks', https://www.bbc.com/news/articles/cd11kp3260xo","Race to rescue villagers trapped after landslide, https://www.bbc.com/news/articles/c877jnjn4m5o"
https://www.aljazeera.com,2024-05-25 05:32:25.800900,"‘End this nightmare’: Israel vows to continue Rafah war despite court order, https://www.aljazeera.com/news/liveblog/2024/5/25/israels-war-on-gaza-live-news-end-this-nightmare","Phase 6 voting under way as India nears end of mammoth Lok Sabha election, https://www.aljazeera.com/news/liveblog/2024/5/25/india-election-2024-live-news-58-seats-vote-in-phase-6-of-lok-sabha-polls","ICJ orders Israel to halt Rafah assault amid ‘immense risk’ to Palestinians, https://www.aljazeera.com/news/2024/5/24/icj-orders-israel-to-halt-its-offensive-on-rafah-gaza-in-new-ruling"
https://www.economist.com,2024-05-24 05:32:36.049107,"The war-crimes case against the leaders of Israel and Hamas is flawed, https://www.economist.com/leaders/2024/05/23/the-war-crimes-case-against-the-leaders-of-israel-and-hamas-is-flawed","Olaf Scholz on why Vladimir Putin’s brutal imperialism will fail, https://www.economist.com/by-invitation/2024/05/23/olaf-scholz-on-why-vladimir-putins-brutal-imperialism-will-fail","Could the Labour Party blow its big opportunity?, https://www.economist.com/britain/2024/05/23/could-the-labour-party-blow-its-big-opportunity"
https://www.lemonde.fr/en/,2024-05-24 05:32:35.017035,"In France, climate issues are absent from the EU election campaign, https://www.lemonde.fr/en/politics/article/2024/05/24/in-france-climate-issues-are-absent-from-the-eu-election-campaign_6672515_5.html","EU elections: French PM debates far right's Bardella in bid to close poll gap, https://www.lemonde.fr/en/politics/article/2024/05/23/eu-elections-french-pm-debates-far-right-s-bardella-in-bid-to-close-poll-gap_6672491_5.html","Several top Russian army officials arrested in recent crackdown, https://www.lemonde.fr/en/international/article/2024/05/23/several-top-russian-army-officials-arrested-in-recent-crackdown_6672496_4.html"
https://www.bbc.com,2024-05-24 05:32:34.324157,"Four dead and 16 injured in Majorca building collapse, https://www.bbc.com/news/articles/cldd222zn4po","Ohio lawmakers urged to add Biden to November ballot, https://www.bbc.com/news/articles/c1rrqj7ypzlo","‘If they see us they will bomb us’ - watch as BBC reaches a hidden war’s jungle front line, https://www.bbc.com/news/videos/cxeevn4pe1jo"
https://www.aljazeera.com,2024-05-24 05:32:33.683855,"‘Condemned to death’: Fear for patients as key Gaza hospital loses power, https://www.aljazeera.com/news/liveblog/2024/5/24/israels-war-on-gaza-live-news-at-least-60-palestinians-killed-in-attacks","The battle for Delhi: Will Modi’s BJP pass bellwether Indian election test?, https://www.aljazeera.com/news/2024/5/24/the-battle-for-delhi-will-modis-bjp-pass-its-bellwether-election-test","China says war games around Taiwan to test ability to ‘seize power’, https://www.aljazeera.com/news/2024/5/24/china-says-war-games-around-taiwan-to-test-ability-to-seize-power"
https://www.economist.com,2024-05-23 05:34:12.833996,"Le Pen’s hard right looks set to crush Macron’s centrists, https://www.economist.com/europe/2024/05/22/le-pens-hard-right-looks-set-to-crush-macrons-centrists","Can anyone save the world’s most important diamond company?, https://www.economist.com/business/2024/05/22/can-anyone-save-the-worlds-most-important-diamond-company","A president’s death gives Iran’s regime a choice, https://www.economist.com/leaders/2024/05/22/a-presidents-death-gives-irans-regime-a-choice"
https://www.lemonde.fr/en/,2024-05-23 05:34:11.821675,"When will China try to take over Taiwan?, https://www.lemonde.fr/en/asia-and-pacific/article/2024/05/23/when-will-china-try-to-take-over-taiwan_6672375_153.html","In riot-hit New Caledonia, Macron says priority is return to calm, https://www.lemonde.fr/en/france/article/2024/05/23/in-riot-hit-new-caledonia-macron-says-priority-is-return-to-calm-amid-unrest_6672356_7.html","Atalanta win Europa League beating Bayer Leverkusen 3-0, https://www.lemonde.fr/en/sports/article/2024/05/22/atalanta-win-europa-league-beating-bayer-leverkusen-3-0_6672342_9.html"
https://www.bbc.com,2024-05-23 05:34:10.594580,"UK election campaign kicks off after surprise poll announcement, https://www.bbc.com/news/live/uk-politics-69051548","The Mexican state where candidates are gunned down as they push for votes, https://www.bbc.com/news/articles/c299p249nx5o","China holds military drills around Taiwan as 'punishment', https://www.bbc.com/news/live/world-asia-69051793"
https://www.aljazeera.com,2024-05-23 05:34:09.867868,"Israeli army pushes deeper into Gaza civilian zones as condemnation grows, https://www.aljazeera.com/news/liveblog/2024/5/23/israels-war-on-gaza-live-news-full-scale-rafah-invasion-appears-imminent","‘Strong punishment’: China starts two days of military drills around Taiwan, https://www.aljazeera.com/news/2024/5/23/china-starts-military-drills-around-the-self-governed-island-of-taiwan","After Japan’s comeback, South Korea is hoping for its own stock market boom, https://www.aljazeera.com/economy/2024/5/23/after-japans-comeback-south-korea-is-hoping-for-its-own-stock-market-boom"
https://www.economist.com,2024-05-22 05:34:35.841816,"Can the rich world escape its baby crisis?, https://www.economist.com/finance-and-economics/2024/05/21/can-the-rich-world-escape-its-baby-crisis","The death of the president changes the power dynamics in Iran, https://www.economist.com/middle-east-and-africa/2024/05/21/the-death-of-the-president-changes-the-power-dynamics-in-iran","China’s version of levelling up is not going well, https://www.economist.com/china/2024/05/21/chinas-version-of-levelling-up-is-not-going-well"
https://www.lemonde.fr/en/,2024-05-22 05:34:34.896978,"Twelve days of hell on the front in Ukraine, https://www.lemonde.fr/en/international/article/2024/05/22/twelve-days-of-hell-on-the-front-in-ukraine_6672234_4.html","EU: Environmental NGOs struggle against lobbyists to defend electronic device sustainability, https://www.lemonde.fr/en/pixels/article/2024/05/22/eu-environmental-ngos-struggle-against-lobbyists-to-defend-electronic-device-sustainability_6672240_13.html","New Caledonia: Macron's ultimatum strategy, https://www.lemonde.fr/en/politics/article/2024/05/22/new-caledonia-emmanuel-macron-s-ultimatum-strategy_6672215_5.html"
https://www.bbc.com,2024-05-22 05:34:33.931681,"Singapore Airlines CEO apologises for 'traumatic experience', https://www.bbc.com/news/live/world-69044396?src_origin=BBCS_BBC","US signals support for possible ICC sanctions over Israel warrants, https://www.bbc.com/news/articles/cp66e6ppzd0o","Armies of young insurgents are changing the course of a forgotten war, https://www.bbc.com/news/articles/c0600jgey2po"
https://www.aljazeera.com,2024-05-22 05:34:33.217243,"Israel’s military repeatedly attacks besieged hospitals in northern Gaza, https://www.aljazeera.com/news/liveblog/2024/5/22/israels-war-on-gaza-live-famine-fears-rise-as-aid-failure-escalates","Gaza war: What does victory look like for the US and Israel?, https://www.aljazeera.com/news/2024/5/22/gaza-war-what-does-victory-look-like-for-the-us-and-israel","Russia starts ‘tactical nuclear drills’ near Ukraine border, https://www.aljazeera.com/news/2024/5/22/russia-starts-tactical-nuclear-drills-near-ukraine-border"
https://www.economist.com,2024-05-21 05:33:15.541217,"The ICC’s threat to arrest Binyamin Netanyahu has shocked Israel, https://www.economist.com/middle-east-and-africa/2024/05/20/the-iccs-threat-to-arrest-binyamin-netanyahu-has-shocked-israel","Iran’s new leaders stand at a nuclear precipice, https://www.economist.com/international/2024/05/20/irans-new-leaders-stand-at-a-nuclear-precipice","At long last, Europe’s economy is starting to grow, https://www.economist.com/finance-and-economics/2024/05/20/at-long-last-europes-economy-is-starting-to-grow"
