org,scraped_at,headline_1,headline_2,headline_3
https://www.aljazeera.com,2024-11-11 05:37:50.364586,"Anger, grief in Gaza’s Jabalia after single Israeli attack kills 36 people, https://www.aljazeera.com/news/liveblog/2024/11/11/live-israeli-attacks-kill-dozens-in-gaza-lebanon-syria","Trump pressures GOP Senate leadership hopefuls to fill cabinet quickly, https://www.aljazeera.com/news/2024/11/11/trump-pressures-gop-senate-leadership-hopefuls-to-fill-cabinet-quickly","Trump, Scholz discuss ‘return to peace in Europe’, https://www.aljazeera.com/news/2024/11/11/trump-scholz-discuss-return-to-peace-in-europe"
https://www.economist.com,2024-11-10 05:34:46.732564,"Welcome to Trump’s world, https://www.economist.com/leaders/2024/11/06/welcome-to-trumps-world","The return of Trumponomics excites markets but frightens the world, https://www.economist.com/finance-and-economics/2024/11/06/the-return-of-trumponomics-excites-markets-but-frightens-the-world","Why open-source AI models are good for the world, https://www.economist.com/leaders/2024/11/07/why-open-source-ai-models-are-good-for-the-world"
https://www.lemonde.fr/en/,2024-11-10 05:34:45.707759,"War in Ukraine: Western embarrassment at North Korean involvement, https://www.lemonde.fr/en/international/article/2024/11/10/war-in-ukraine-western-embarrassment-at-north-korean-involvement_6732271_4.html","Qatar suspends Gaza mediation until Israel and Hamas show 'seriousness,' says foreign ministry, https://www.lemonde.fr/en/international/article/2024/11/09/qatar-suspends-gaza-mediation-until-israel-and-hamas-show-seriousness-says-foreign-ministry_6732269_4.html","2024 US Election: Donald Trump wins Arizona in swing state sweep, https://www.lemonde.fr/en/united-states/article/2024/11/10/2024-us-election-donald-trump-wins-arizona_6732283_133.html"
https://www.bbc.com,2024-11-10 05:34:44.850058,"Qatar suspends role as mediator between Israel and Hamas, https://www.bbc.com/news/articles/c774d4p2mx6o","In Russia's shadow: The Baltics wait for Europe's strategic new railway, https://www.bbc.com/news/articles/cx2n4r9reejo","Trump projected to win Arizona, completing clean sweep of swing states , https://www.bbc.com/news/live/c2e7jdjdmplt"
https://www.aljazeera.com,2024-11-10 05:34:43.950920,"Israeli forces kill 44 in Gaza, 31 in Lebanon; Qatar suspends mediation, https://www.aljazeera.com/news/liveblog/2024/11/10/live-israeli-warships-kill-3-palestinians-released-from-detention-in-gaza","India bets on Modi-Trump warmth to navigate choppy future with US, https://www.aljazeera.com/news/2024/11/10/india-bets-on-modi-trump-warmth-to-navigate-choppy-future-with-us","In Lebanon, ‘misleading’ and sporadic Israeli evacuation orders instil fear, https://www.aljazeera.com/features/2024/11/10/in-lebanon-misleading-and-sporadic-israeli-evacuation-orders-instil-fear"
https://www.economist.com,2024-11-09 05:35:18.570112,"America’s allies brace for brinkmanship, deals—and betrayal, https://www.economist.com/international/2024/11/07/americas-allies-brace-for-brinkmanship-deals-and-betrayal","China’s stimulus falls short, https://www.economist.com/china/2024/11/08/chinas-stimulus-falls-short-as-a-showdown-with-trump-looms","Donald Trump is poised to smash Mexico with tariffs, https://www.economist.com/the-americas/2024/11/07/donald-trump-is-poised-to-smash-mexico-with-tariffs"
https://www.lemonde.fr/en/,2024-11-09 05:35:17.626992,"How can the left fight the far right? Two philosophers' ideas for countering nationalism, https://www.lemonde.fr/en/opinion/article/2024/11/09/how-can-the-left-fight-the-far-right-two-philosophers-ideas-for-countering-nationalism_6732196_23.html","Trump's victory clears way for Netanyahu to do whatever he likes, https://www.lemonde.fr/en/international/article/2024/11/08/trump-s-victory-clears-way-for-netanyahu-to-do-whatever-he-likes_6732162_4.html","US DOJ brings criminal charges against Iranian government asset in plan to kill Donald Trump, https://www.lemonde.fr/en/international/article/2024/11/08/criminal-charges-in-iranian-plan-to-kill-donald-trump_6732170_4.html"
https://www.bbc.com,2024-11-09 05:35:16.882741,"'They shouted Jewish, IDF': Israeli football fans describe attack in Amsterdam, https://www.bbc.com/news/articles/ckgv4mdr9y8o","Is this tiny Mauritian island a secret spy station?, https://www.bbc.com/news/articles/cvg47274y4no","Pelosi blames Biden for election loss as finger pointing intensifies, https://www.bbc.com/news/articles/cn7m24zg85eo"
https://www.aljazeera.com,2024-11-09 05:35:16.040001,"Israeli air strikes pound Beirut; famine feared in besieged northern Gaza, https://www.aljazeera.com/news/liveblog/2024/11/9/live-israeli-air-strikes-shake-beirut-famine-fears-in-besieged-north-gaza","The girl with sun-shaped earrings: A family remembers a murdered daughter, https://www.aljazeera.com/features/2024/11/9/the-girl-with-sun-shaped-earrings-a-family-remembers-a-murdered-daughter","South Korea’s military blames North Korea on GPS signal ‘jamming attack’, https://www.aljazeera.com/news/2024/11/9/south-koreas-military-blames-north-korea-on-gps-signal-jamming-attack"
https://www.economist.com,2024-11-05 05:37:13.376724,"What to watch for on election night, and beyond, https://www.economist.com/united-states/2024/10/31/what-to-watch-for-on-election-night-and-beyond","The risk of election violence in America is real, https://www.economist.com/united-states/2024/11/05/the-risk-of-election-violence-in-america-is-real","In some areas of military strength, China has surpassed America, https://www.economist.com/china/2024/11/04/in-some-areas-of-military-strength-china-has-surpassed-america"
https://www.lemonde.fr/en/,2024-11-05 05:37:12.242692,"US election: An electric campaign and a crucial choice for the country, https://www.lemonde.fr/en/international/article/2024/11/05/2024-us-election-an-electric-campaign-and-a-crucial-choice-for-the-country_6731601_4.html","Trump says 'if we win Pennsylvania – it's over,' as Harris tactically calls her rival 'the other guy' in final push, https://www.lemonde.fr/en/united-states/article/2024/11/05/if-we-win-pennsylvania-it-s-over-says-trump-as-harris-calls-her-rival-the-other-guy-urging-voters-to-make-a-difference_6731582_133.html","Lady Gaga, Christina Aguilera – Harris brings in celebrities galore on US election eve, but Donald Trump is unimpressed, https://www.lemonde.fr/en/united-states/article/2024/11/05/lady-gaga-christina-aguilera-kamala-harris-brings-in-celebrities-galore-on-us-election-eve-but-donald-trump-is-unimpressed_6731602_133.html"
https://www.bbc.com,2024-11-05 05:37:11.568677,"Elon Musk can keep giving $1m to voters, judge rules, https://www.bbc.com/news/articles/cx2d7y87z0jo","America braced as two stark visions collide on election day, https://www.bbc.com/news/articles/crlnjzzk919o","Elon Musk can keep giving $1m to voters, judge rules, https://www.bbc.com/news/live/cg57dg5zyzrt"
https://www.aljazeera.com,2024-11-05 05:37:10.791271,"Israel again bombs Gaza’s Kamal Adwan Hospital, wounding newborns, staff, https://www.aljazeera.com/news/liveblog/2024/11/5/live-israel-bombs-syria-attacks-gazas-kamal-adwan-hospital-again","Harris, Trump make last appeals to voters on eve of US election, https://www.aljazeera.com/news/liveblog/2024/11/4/us-election-live-latest-polls-show-trump-harris-in-final-stretch-deadlock","Boeing workers vote to end seven-week strike, https://www.aljazeera.com/economy/2024/11/5/boeing-workers-vote-to-end-7-week-strike"
https://www.economist.com,2024-11-04 05:38:13.600342,"Why half of America will vote for Donald Trump, https://www.economist.com/united-states/2024/11/03/why-half-of-america-will-vote-for-donald-trump","Investors are betting that Donald Trump will boost the dollar, https://www.economist.com/finance-and-economics/2024/11/03/investors-are-betting-that-donald-trump-will-boost-the-dollar","What the world thinks of Trump, Ukraine and Chinese supremacy, https://www.economist.com/international/2024/11/03/what-the-world-thinks-of-trump-ukraine-and-chinese-supremacy"
https://www.lemonde.fr/en/,2024-11-04 05:38:12.738290,"Donald Trump or Kamala Harris, a crucial choice for the climate, https://www.lemonde.fr/en/environment/article/2024/11/04/donald-trump-or-kamala-harris-a-crucial-choice-for-the-climate_6731478_114.html","Angry flood survivors throw mud and insults at Spain's King Felipe, https://www.lemonde.fr/en/climate/article/2024/11/03/angry-flood-survivors-throw-mud-and-insults-at-spain-s-king-felipe_6731426_96.html","US Election: Harris 'momentum' disproves Trump's 'landslide' prediction as the neck and neck rivals race to the finish line, https://www.lemonde.fr/en/united-states/article/2024/11/04/us-election-harris-momentum-disproves-trump-s-landslide-prediction-as-the-neck-and-neck-rivals-race-to-the-finish-line_6731471_133.html"
https://www.bbc.com,2024-11-04 05:38:12.103464,"What Harris's years as a prosecutor reveal about who she is now, https://www.bbc.com/news/articles/cly2d4evq5po","Dawson's Creek actor reveals cancer diagnosis , https://www.bbc.com/news/articles/c4gmrn0mxrno","Harris vows to end Gaza war, Trump says RFK Jr would have 'big role' in administration, https://www.bbc.com/news/live/cg57dg5zyzrt"
https://www.aljazeera.com,2024-11-04 05:38:11.222337,"Israel attacks hospitals in Gaza and Lebanon, kills 2 more Lebanese medics, https://www.aljazeera.com/news/liveblog/2024/11/4/live-israeli-forces-attack-health-centres-in-gaza-and-lebanon","Trump or Harris? Arab Americans united in grief, divided on strategy, https://www.aljazeera.com/news/2024/11/4/us-election-arab-americans-united-in-grief-divided-on-strategy","China’s small manufacturers anguish over Trump’s tariff plans, https://www.aljazeera.com/economy/2024/11/4/chinas-small-manufacturers-anguish-over-trumps-tariff-plans"
https://www.economist.com,2024-11-03 05:36:08.975155,"A second Trump term comes with unacceptable risks, https://www.economist.com/leaders/2024/10/31/a-second-trump-term-comes-with-unacceptable-risks","How to avoid anarchy in Antarctica, https://www.economist.com/leaders/2024/10/31/how-to-avoid-anarchy-in-antarctica","1843 magazine | Why aren’t Harris and Trump listening to Pennsylvania’s steelworkers?, https://www.economist.com/1843/2024/11/01/why-arent-harris-and-trump-listening-to-pennsylvanias-steelworkers"
https://www.lemonde.fr/en/,2024-11-03 05:36:07.661606,"In the last weekend on the campaign trail, Harris and Trump focus on Sunbelt states, https://www.lemonde.fr/en/international/article/2024/11/02/in-the-last-weekend-on-the-campaign-trail-harris-and-trump-are-zeroing-in-on-sunbelt-states_6731379_4.html","Harris on 'Saturday Night Live' as the mirror image of Maya Rudolph three days before election, https://www.lemonde.fr/en/international/article/2024/11/03/live-from-new-york-harris-makes-surprise-snl-appearance-with-election-looming_6731395_4.html","War in Ukraine: In the Donbas region, the Russian army inches forward, https://www.lemonde.fr/en/international/article/2024/11/02/war-in-ukraine-in-the-donbas-region-the-russian-army-inches-forward_6731381_4.html"
https://www.bbc.com,2024-11-03 05:36:06.856249,"Crowdsourced voter fraud claims flood social media before US election, https://www.bbc.com/news/articles/czj7eex29r3o","Outpouring of unity in Spain as anger grows over slow response to floods, https://www.bbc.com/news/articles/c3deke3ey58o","Harris appears in SNL sketch, while Trump says election will be 'liberation day', https://www.bbc.com/news/live/c74l39543q5t"
https://www.aljazeera.com,2024-11-03 05:36:05.873699,"Israeli forces killed over 50 children in 48 hours in 1 Gaza town, UN says, https://www.aljazeera.com/news/liveblog/2024/11/3/live-israel-attacks-gaza-polio-centre-syria-lebanon-border-crossing","Gaza polio vaccination drive resumes as Israel continues attacks, https://www.aljazeera.com/news/2024/11/2/gaza-polio-vaccination-drive-resumes-as-israel-continues-attacks","Mariner abducted in northern Lebanon coastal raid, https://www.aljazeera.com/news/2024/11/2/mariner-abducted-in-northern-lebanon-coastal-raid"
https://www.economist.com,2024-11-02 05:36:45.433230,"How bad could a second Trump presidency get?, https://www.economist.com/briefing/2024/10/31/how-bad-could-a-second-trump-presidency-get","When politics is about hating the other side, democracy suffers, https://www.economist.com/interactive/essay/2024/10/31/when-politics-is-about-hating-the-other-side-democracy-suffers","What happens in the days after America’s election, https://www.economist.com/interactive/united-states/2024/11/01/what-happens-in-the-days-after-americas-election"
https://www.lemonde.fr/en/,2024-11-02 05:36:44.529422,"How Le Monde has covered race in the US, https://www.lemonde.fr/en/international/article/2024/11/02/how-le-monde-has-covered-race-in-the-us_6731298_4.html","Trump and Harris hold dueling rallies in battleground Wisconsin amid tense four-day countdown to US Election Day, https://www.lemonde.fr/en/united-states/article/2024/11/01/trump-and-harris-hold-dueling-rallies-in-battleground-wisconsin-amid-tense-four-day-countdown-to-us-election-day_6731280_133.html","Lebanon accuses Israel of rejecting truce after Beirut strikes, https://www.lemonde.fr/en/international/article/2024/11/02/lebanon-accuses-israel-of-rejecting-truce-after-beirut-strikes_6731303_4.html"
https://www.bbc.com,2024-11-02 05:36:43.789990,"Kim Jong Un was China's ally - until he became the 'comrade from hell', https://www.bbc.com/news/articles/c207gzprr33o","Swapped at birth: How a DNA test changed two women's lives, https://www.bbc.com/news/articles/cp3njqd9nl9o","Harris campaigns with Cardi B as Trump hosts duelling rally in Milwaukee, https://www.bbc.com/news/live/c74l39543q5t"
https://www.aljazeera.com,2024-11-02 05:36:42.919195,"‘Brutal massacres’: 50 children among 84 killed as Israel bombs Gaza homes, https://www.aljazeera.com/news/liveblog/2024/11/2/live-israel-massacres-84-in-gaza-air-strikes-kill-dozens-across-lebanon","As Trump, Harris woo Arab Americans, Michigan mayor readies to up pressure, https://www.aljazeera.com/news/2024/11/1/as-trump-harris-woo-arab-americans-michigan-mayor-readies-to-up-pressure","Duelling rallies in Milwaukee as Harris and Trump sprint to the end, https://www.aljazeera.com/news/2024/11/2/harris-and-trump-hold-last-friday-night-rallies-in-battleground-milwaukee"
https://www.economist.com,2024-11-01 05:37:44.274141,"ADHD should not be treated as a disorder, https://www.economist.com/leaders/2024/10/30/adhd-should-not-be-treated-as-a-disorder","Volkswagen’s woes illustrate Germany’s creeping deindustrialisation, https://www.economist.com/business/2024/10/31/volkswagens-woes-illustrate-germanys-creeping-deindustrialisation","Triple trouble awaits Mexico if Donald Trump wins, https://www.economist.com/the-americas/2024/10/30/triple-trouble-awaits-mexico-if-donald-trump-wins"
https://www.lemonde.fr/en/,2024-11-01 05:37:43.135873,"Ukrainians in Russian-occupied Donbas find ways to escape: 'It wasn't real life, I had to leave', https://www.lemonde.fr/en/international/article/2024/11/01/ukrainians-in-russian-occupied-donbas-find-ways-to-escape-it-wasn-t-real-life-i-had-to-leave_6731206_4.html","For Macron's visit to Morocco, some surprising guests were among plethoric delegation, https://www.lemonde.fr/en/france/article/2024/10/31/for-macron-s-visit-to-morocco-some-surprising-guests-were-among-plethoric-delegation_6731148_7.html","Harris turns her attention to women's rights after Trump's latest 'offensive' protector language, https://www.lemonde.fr/en/united-states/article/2024/11/01/harris-turns-her-attention-to-women-s-rights-after-trump-s-latest-offensive-protector-language_6731202_133.html"
https://www.bbc.com,2024-11-01 05:37:42.489654,"Different lives - Harris and Trump as you've never seen them before, https://www.bbc.com/news/articles/ce81g75lzplo","Hidden sugars in Asia’s baby food spark concerns, https://www.bbc.com/news/articles/cy0g82n9e4go","US election weighs on Ukraine's frontline soldiers, https://www.bbc.com/news/articles/cr5m6d6l7e2o"
https://www.aljazeera.com,2024-11-01 05:37:41.760206,"Israel bombs Beirut, UN says Israeli forces targeted Gaza’s health system, https://www.aljazeera.com/news/liveblog/2024/11/1/live-israeli-attacks-kill-95-in-gaza-6-medics-among-45-killed-in-lebanon","Jennifer Lopez joins Harris for Las Vegas rally as she and Trump hit Nevada, https://www.aljazeera.com/news/liveblog/2024/10/31/us-election-live-polls-show-close-race-as-trump-harris-rally-in-nevada","US election: Why is Kamala Harris losing Indian American voters?, https://www.aljazeera.com/news/2024/11/1/us-election-why-is-kamala-harris-losing-indian-american-voters"
https://www.economist.com,2024-10-31 05:38:35.558674,"The British budget combines large numbers and a narrow vision, https://www.economist.com/leaders/2024/10/30/the-british-budget-combines-large-numbers-and-a-narrow-vision","Why Kamala Harris’s chances of victory just jumped, https://www.economist.com/united-states/2024/10/30/why-kamala-harriss-chances-of-victory-just-jumped","Donald Trump would leave Asia with only bad options, https://www.economist.com/finance-and-economics/2024/10/30/donald-trump-would-leave-asia-with-only-bad-options"
https://www.lemonde.fr/en/,2024-10-31 05:38:34.461491,"Around Valencia, almost a hundred dead in the 'floods of the century': 'The water came all at once, like a tsunami', https://www.lemonde.fr/en/environment/article/2024/10/30/around-valencia-almost-a-hundred-dead-in-the-floods-of-the-century-the-water-came-all-at-once-like-a-tsunami_6731061_114.html","US and South Korea call for North Korea to withdraw troops from Russia, https://www.lemonde.fr/en/international/article/2024/10/31/us-and-south-korea-call-for-north-korea-to-withdraw-troops-from-russia_6731067_4.html","Beyoncé and Harris, Heston and Reagan, Sinatra and JFK ... the stars who support US presidential candidates, https://www.lemonde.fr/en/m-le-mag/article/2024/10/30/beyonce-and-harris-heston-and-reagan-sinatra-and-jfk-the-stars-who-support-us-presidential-candidates_6731064_117.html"
https://www.bbc.com,2024-10-31 05:38:33.655308,"'Like a tsunami': Spaniards recount horror of deadly floods, https://www.bbc.com/news/articles/c8ekdp4r6kpo","Trump speaks in garbage collector uniform in dig at Biden as Harris says 'we will win', https://www.bbc.com/news/live/cx2n4l79dn7t","Spain battles deadliest flood disaster in decades as death toll rises to 95, https://www.bbc.com/news/articles/c99ry7x925eo"
https://www.aljazeera.com,2024-10-31 05:38:32.883872,"Israel kills 19 in Lebanon as Mikati expresses hope for a truce within days, https://www.aljazeera.com/news/liveblog/2024/10/31/live-israel-pounds-gaza-lebanon-amid-hopes-of-a-truce-with-hezbollah","‘Ready to die’: Protesters face bullets for political change in Mozambique, https://www.aljazeera.com/features/2024/10/31/ready-to-dieprotesters-face-bullets-for-political-change-in-mozambique","North Korea confirms launch of ICBM in longest-ever ballistic missile test, https://www.aljazeera.com/news/2024/10/30/north-korea-launches-ballistic-missile-towards-the-sea-south-korea-says"
https://www.economist.com,2024-10-30 05:38:32.950659,"Ukraine is now struggling to survive, not to win, https://www.economist.com/europe/2024/10/29/ukraine-is-now-struggling-to-survive-not-to-win","How wrong could America’s pollsters be?, https://www.economist.com/united-states/2024/10/29/how-wrong-could-americas-pollsters-be","Why China may be saving its bazooka for Donald Trump, https://www.economist.com/china/2024/10/29/why-china-may-be-saving-its-bazooka-for-donald-trump"
https://www.lemonde.fr/en/,2024-10-30 05:38:31.995091,"Shell companies, ghost ships and secret traders: How Russia circumvents Western oil sanctions, https://www.lemonde.fr/en/les-decodeurs/article/2024/10/30/shell-companies-ghost-ships-and-secret-traders-how-russia-circumvents-western-oil-sanctions_6730981_8.html","US election: Kamala Harris promises to 'put country above party,' a 'direct contrast' to Trump in speech at symbolic site, https://www.lemonde.fr/en/united-states/article/2024/10/30/us-election-kamala-harris-promises-to-put-country-above-party-a-direct-contrast-to-trump-in-speech-at-symbolic-site_6730954_133.html","Putin's bodyguards go on runs near palace he denies owning: StravaLeaks part 3, https://www.lemonde.fr/en/international/article/2024/10/29/putin-s-bodyguards-go-on-runs-near-palace-he-denies-owning-stravaleaks-episode-3_6730915_4.html"
https://www.bbc.com,2024-10-30 05:38:31.292162,"What this election means for the rest of the world, https://www.bbc.com/news/articles/cgl490zrz45o","China declares success as its youngest astronauts reach space, https://www.bbc.com/news/articles/c5yp47prg7jo","Harris vows end to 'drama and conflict' - but Biden's 'garbage' comment triggers row  , https://www.bbc.com/news/live/clyggepq86vt"
https://www.aljazeera.com,2024-10-30 05:38:30.486653,"Israeli air strikes kill 143 across Gaza, more than 77 in Lebanon, https://www.aljazeera.com/news/liveblog/2024/10/30/live-israeli-strikes-kill-143-across-gaza-77-killed-in-attacks-on-lebanon","Israel again bombs Gaza’s Beit Lahiya hours after killing 93 in one strike, https://www.aljazeera.com/news/2024/10/30/israel-bombs-gazas-beit-lahiya-a-day-after-killing-ninety-three-in-one-strike","‘Not who we are’: Harris seeks finish line push at crowded US capital rally, https://www.aljazeera.com/news/2024/10/30/not-who-we-are-harris-seeks-finish-line-push-at-crowded-us-capital-rally"
https://www.economist.com,2024-10-29 05:38:11.713619,"What if Microsoft let OpenAI go free?, https://www.economist.com/business/2024/10/28/what-if-microsoft-let-openai-go-free","War is not the only reason some Muslims are ditching the Democrats, https://www.economist.com/united-states/2024/10/28/war-is-not-the-only-reason-some-muslims-are-ditching-the-democrats","Will a humiliated Iran choose a nuclear bomb or a love bomb?, https://www.economist.com/middle-east-and-africa/2024/10/28/will-a-humiliated-iran-choose-a-nuclear-bomb-or-a-love-bomb"
https://www.lemonde.fr/en/,2024-10-29 05:38:10.703662,"Biden and Trump put in danger by Secret Service agents: Watch the second episode of StravaLeaks, https://www.lemonde.fr/en/united-states/article/2024/10/28/biden-and-trump-put-in-danger-by-secret-service-agents-watch-the-second-episode-of-stravaleaks_6730825_133.html","Israeli parliament approves ban on UNRWA in Israel, https://www.lemonde.fr/en/international/article/2024/10/28/israeli-parliament-approves-ban-on-unrwa-in-israel_6730845_4.html","Trump reminded of 'huge numbers' of Puerto Ricans in swing states day after 'floating island of garbage' remark at his NYC rally, https://www.lemonde.fr/en/international/article/2024/10/28/democrats-escalate-critics-of-trump-after-comedian-calls-puerto-rico-floating-island-of-garbage-at-his-nyc-rally_6730855_4.html"
https://www.bbc.com,2024-10-29 05:38:09.975540,"What satellite images reveal about Israel's strikes on Iran, https://www.bbc.com/news/articles/cy7dkgz71x6o","Puerto Rico archbishop and GOP leader demand Trump apology over 'garbage' row, https://www.bbc.com/news/live/clyggepq86vt","Gaza aid fears as Israel bans UN Palestinian refugee agency, https://www.bbc.com/news/articles/c4gp2ejzpxeo"
https://www.aljazeera.com,2024-10-29 05:38:09.328372,"World condemns Israel’s UNRWA ban; Israeli army kills 60 in Lebanon’s Bekaa, https://www.aljazeera.com/news/liveblog/2024/10/29/live-warnings-israels-unrwa-ban-will-collapse-aid-efforts-in-gaza","Pentagon says North Korea sent 10,000 troops to join Russian war in Ukraine, https://www.aljazeera.com/news/2024/10/29/pentagon-says-north-korea-sent-ten-thousand-troops-to-join-russian-war-in-ukraine","‘Intolerable’, ‘dangerous precedent’: World condemns Israel’s UNRWA ban, https://www.aljazeera.com/news/2024/10/29/intolerable-dangerous-precedent-world-condemns-israels-unrwa-ban"
https://www.economist.com,2024-10-28 05:38:27.555927,"America’s glorious economy should help Kamala Harris, https://www.economist.com/finance-and-economics/2024/10/27/americas-glorious-economy-should-help-kamala-harris","The data hinted at racism among white doctors. Then scholars looked again, https://www.economist.com/united-states/2024/10/27/the-data-hinted-at-racism-among-white-doctors-then-scholars-looked-again","Another domino falls to Vladimir Putin after Georgia’s tense election, https://www.economist.com/europe/2024/10/27/another-domino-falls-to-vladimir-putin-after-georgias-tense-election"
https://www.lemonde.fr/en/,2024-10-28 05:38:26.650517,"How Emmanuel Macron can be tracked: Watch the first episode of StravaLeaks, https://www.lemonde.fr/en/france/article/2024/10/27/how-emmanuel-macron-can-be-tracked-watch-the-first-episode-of-stravaleaks_6730708_7.html","Trump's New York rally draws criticism as he ramps up Harris attacks, https://www.lemonde.fr/en/united-states/article/2024/10/28/trump-s-new-york-rally-draws-criticism-as-he-ramps-up-harris-attacks_6730742_133.html","South of Beirut, Sainte-Thérèse hospital under constant threat from Israeli bombs, https://www.lemonde.fr/en/international/article/2024/10/28/south-of-beirut-sainte-therese-hospital-under-constant-threat-from-israeli-bombs_6730764_4.html"
https://www.bbc.com,2024-10-28 05:38:25.991988,"Georgia PM rejects vote-rigging claims as president calls mass rally, https://www.bbc.com/news/articles/c78ddj25kgvo","Japan's ruling party loses its majority in blow to new PM, https://www.bbc.com/news/articles/c8xpev42g78o","Harris attacks huge Trump New York rally as 'divisive and demeaning', https://www.bbc.com/news/live/clyggepq86vt"
