org,scraped_at,headline_1,headline_2,headline_3
https://www.bbc.com,2024-08-31 05:34:33.466619,"Girl, 14, killed as Russian strike hits Kharkiv playground, https://www.bbc.com/news/articles/c4gl8y34389o","Harris unscathed after walking careful line in first interview, https://www.bbc.com/news/articles/crlr46kepnjo","Musk's X banned in Brazil after disinformation row, https://www.bbc.com/news/articles/c5y3rnl5qv3o"
https://www.aljazeera.com,2024-08-31 05:34:32.628549,"Israeli forces bombard Gaza; impose siege on occupied West Bank’s Jenin, https://www.aljazeera.com/news/liveblog/2024/8/31/israels-war-on-gaza-live-israel-bombards-gaza-besieges-west-banks-jenin","Afghanistan is a US election issue. Will its refugees’ voices be heard?, https://www.aljazeera.com/news/2024/8/30/afghanistan-is-a-us-election-issue-will-its-refugees-voices-be-heard","Zelenskyy fires Ukraine’s air force commander after deadly F-16 crash, https://www.aljazeera.com/news/2024/8/30/zelenskyy-fires-ukraines-air-force-commander-after-deadly-f-16-crash"
https://www.economist.com,2024-08-30 05:35:59.860145,"From Southwest to Spirit, budget airlines are in a tailspin, https://www.economist.com/business/2024/08/29/from-southwest-to-spirit-budget-airlines-are-in-a-tailspin","Donald Trump’s dream of mass deportations is a fantasy, https://www.economist.com/united-states/2024/08/29/donald-trumps-dream-of-mass-deportations-is-a-fantasy","The plasma trade is becoming ever-more hypocritical, https://www.economist.com/finance-and-economics/2024/08/29/the-plasma-trade-is-becoming-ever-more-hypocritical"
https://www.lemonde.fr/en/,2024-08-30 05:35:58.960468,"The French widely mistrust politicians, Le Monde survey finds, https://www.lemonde.fr/en/politics/article/2024/08/30/the-french-widely-mistrust-politicians-le-monde-survey-finds_6723762_5.html","Harris rejects 'flip-flop' claims in first campaign interview, says Americans are 'ready to turn the page' on Trump, https://www.lemonde.fr/en/international/article/2024/08/29/harris-rejects-flip-flop-claims-in-first-campaign-interview_6723531_4.html","France, Serbia sign Rafale fighter jet deal during Macron visit, https://www.lemonde.fr/en/international/article/2024/08/29/france-serbia-sign-rafale-fighter-jet-deal-during-macron-visit_6723515_4.html"
https://www.bbc.com,2024-08-30 05:35:58.231396,"Israel agrees to pauses in fighting for polio vaccine drive, https://www.bbc.com/news/articles/cn02z5kjn40o","Inside the sealed-off Jenin refugee camp targeted by IDF, https://www.bbc.com/news/articles/c8ergpxnd8xo","Harris defends White House record in high-stakes first interview, https://www.bbc.com/news/articles/c3ejw1kd7ndo"
https://www.aljazeera.com,2024-08-30 05:35:57.492977,"Polio vaccination to begin on Sunday amid limited pause in fighting: WHO, https://www.aljazeera.com/news/liveblog/2024/8/30/israels-war-on-gaza-live-who-says-polio-vaccination-to-start-on-sunday","Five key takeaways from Kamala Harris, Tim Walz’s first major TV interview, https://www.aljazeera.com/news/2024/8/30/key-takeaways-from-kamala-harris-and-tim-walzs-first-major-tv-interview","Donald Trump promises free IVF for women, criticises six-week abortion ban, https://www.aljazeera.com/news/2024/8/30/donald-trump-pledges-free-ivf-for-women-criticises-six-week-abortion-ban"
https://www.economist.com,2024-08-29 05:35:54.254625,"Who deserves the credit for falling inflation?, https://www.economist.com/leaders/2024/08/28/why-inflation-fell-without-a-recession","How Vladimir Putin hopes to transform Russian trade, https://www.economist.com/finance-and-economics/2024/08/28/how-vladimir-putin-hopes-to-transform-russian-trade","Fixing social care in England is a true test of Labour’s ambition, https://www.economist.com/britain/2024/08/28/fixing-social-care-in-england-is-a-true-test-of-labours-ambition"
https://www.lemonde.fr/en/,2024-08-29 05:35:53.226414,"The 19th-century president the French left wishes Macron would take after, https://www.lemonde.fr/en/politics/article/2024/08/29/the-19th-century-president-the-french-left-wishes-macron-would-take-after_6723115_5.html","Telegram CEO Pavel Durov charged but released under judicial supervision, https://www.lemonde.fr/en/france/article/2024/08/29/telegram-ceo-pavel-durov-charged-but-released-under-judicial-supervision_6723047_7.html","Paris kicks off Paralympics with ceremony in heart of city, https://www.lemonde.fr/en/sports/article/2024/08/28/paris-to-kick-off-paralympics-with-spectacular-ceremony-in-heart-of-city_6722874_9.html"
https://www.bbc.com,2024-08-29 05:35:52.590122,"Telegram boss banned from leaving France in criminal probe, https://www.bbc.com/news/articles/c985ppy0znyo","Spectacular opening ceremony ignites Paris Paralympics, https://www.bbc.com/sport/articles/cp8n01jd9p9o","Why is Harris bringing Walz to her first major interview? , https://www.bbc.com/news/articles/cp3d72dxe5zo"
https://www.aljazeera.com,2024-08-29 05:35:51.698846,"Israel must not extend war on Gaza to occupied West Bank: EU, https://www.aljazeera.com/news/liveblog/2024/8/29/israels-war-on-gaza-live-israel-warned-not-to-extend-war-to-west-bank","US issues more sanctions over Israeli ‘settler violence’ in West Bank, https://www.aljazeera.com/news/2024/8/28/us-issues-more-sanctions-over-israeli-settler-violence-in-west-bank","Hong Kong prepares for Stand News verdict in latest media freedom test, https://www.aljazeera.com/news/2024/8/28/hong-kong-prepares-for-stand-news-verdict-in-latest-media-freedom-test"
https://www.economist.com,2024-08-28 05:35:43.173965,"The arrest of “Russia’s Mark Zuckerberg” rattles social media, https://www.economist.com/business/2024/08/27/the-arrest-of-telegrams-founder-rattles-social-media","Why Texas Republicans are souring on crypto, https://www.economist.com/united-states/2024/08/27/why-texas-republicans-are-souring-on-crypto","Israel’s settlers are winning unprecedented power from the war in Gaza, https://www.economist.com/middle-east-and-africa/2024/08/27/israels-settlers-are-winning-unprecedented-power-from-the-war-in-gaza"
https://www.lemonde.fr/en/,2024-08-28 05:35:42.106442,"Ready for season two of Paris 2024?, https://www.lemonde.fr/en/sports/article/2024/08/28/ready-for-season-two-of-paris-2024_6722584_9.html","Paralympic Games: Interior Ministry and Police Prefecture say there will be significant security measures, https://www.lemonde.fr/en/france/article/2024/08/28/paralympic-games-interior-ministry-and-police-prefecture-say-there-will-be-significant-security-measures_6722548_7.html","Alexander Ekman orchestrates an opening ceremony that will emphasize concord and harmony, https://www.lemonde.fr/en/sports/article/2024/08/28/paralympics-2024-alexander-ekman-orchestrates-an-opening-ceremony-that-will-emphasize-concord-and-harmony_6722547_9.html"
https://www.bbc.com,2024-08-28 05:35:41.457953,"Harris and Walz to sit for first interview of campaign, https://www.bbc.com/news/articles/c935vljzd30o","Ukraine to present 'victory plan' to US - Zelensky, https://www.bbc.com/news/articles/crrlnl2vqe2o","Israeli military launches major West Bank operation, https://www.bbc.com/news/articles/cm2ny546m7go"
https://www.aljazeera.com,2024-08-28 05:35:40.745266,"At least 9 Palestinians killed in major Israeli raids on occupied West Bank, https://www.aljazeera.com/news/liveblog/2024/8/28/israels-war-on-gaza-live-many-still-buried-after-day-of-israeli-strikes","Special counsel Jack Smith issues revised indictment in Trump election case, https://www.aljazeera.com/news/2024/8/27/special-counsel-jack-smith-issues-revised-indictment-in-trump-election-case","A dangerous precedent? Telegram CEO’s arrest a new front in war over speech, https://www.aljazeera.com/economy/2024/8/28/a-dangerous-precedent-telegram-ceos-arrest-a-new-front-in-war-over-speech"
https://www.economist.com,2024-08-27 05:35:08.152800,"The poisonous global politics of water, https://www.economist.com/international/2024/08/26/the-poisonous-global-politics-of-water","What could stop the Nvidia frenzy?, https://www.economist.com/business/2024/08/26/what-could-stop-the-nvidia-frenzy","A language guide for judges is a window into modern Britain, https://www.economist.com/britain/2024/08/26/a-language-guide-for-judges-is-a-window-into-modern-britain"
https://www.lemonde.fr/en/,2024-08-27 05:35:06.890296,"Cuba is facing its worst social crisis since the collapse of the Soviet bloc, https://www.lemonde.fr/en/international/article/2024/08/27/cuba-is-facing-its-worst-social-crisis-since-the-collapse-of-the-soviet-bloc_6722133_4.html","Ukraine hit by largest Russian strike so far in the war, https://www.lemonde.fr/en/international/article/2024/08/27/ukraine-hit-by-largest-russian-strike-so-far-in-the-war_6722059_4.html","Telegram, an app like no other, has largely eluded regulators, https://www.lemonde.fr/en/pixels/article/2024/08/26/telegram-an-app-like-no-other-that-has-largely-eluded-regulators_6721871_13.html"
https://www.bbc.com,2024-08-27 05:35:06.089016,"Surging seas are coming for us all, warns UN chief, https://www.bbc.com/news/articles/c3ej0xx2jpxo","Mariah Carey's mother and sister die on the same day, https://www.bbc.com/news/articles/cx2yd454nzvo","Massive Russian strikes hit Ukraine for second day, https://www.bbc.com/news/articles/ckg1lpe26ylo"
https://www.aljazeera.com,2024-08-27 05:35:05.260900,"Israeli tanks push towards Deir el-Balah forcing UN to halt aid operations, https://www.aljazeera.com/news/liveblog/2024/8/27/israels-war-on-gaza-live-israeli-tanks-near-deir-el-balah-as-un-flees","UAE weighs in on Telegram CEO Pavel Durov’s detention by France, https://www.aljazeera.com/news/2024/8/27/uae-weighs-in-on-telegram-ceo-pavel-durovs-detention-by-france","UN chief warns of ‘unimaginable’ climate catastrophe due to sea level rises, https://www.aljazeera.com/news/2024/8/27/un-chief-issues-climate-sos-warns-of-unimaginable-catastrophe"
https://www.economist.com,2024-08-26 05:35:26.533544,"Israel and Hizbullah play with fire, https://www.economist.com/middle-east-and-africa/2024/08/25/israel-and-hizbullah-play-with-fire","Is Xi Jinping an AI doomer?, https://www.economist.com/china/2024/08/25/is-xi-jinping-an-ai-doomer","India’s largest airline is flying high, https://www.economist.com/business/2024/08/22/indias-largest-airline-is-flying-high"
https://www.lemonde.fr/en/,2024-08-26 05:35:25.541932,"Panic mounts on pro-war Russian Telegram channels after Pavel Durov's arrest, https://www.lemonde.fr/en/pixels/article/2024/08/26/panic-mounts-on-pro-war-russian-telegram-channels-after-pavel-durov-s-arrest_6721621_13.html","How France's ultraright is reconfiguring itself, https://www.lemonde.fr/en/france/article/2024/08/26/how-france-s-ultraright-is-reconfiguring-itself_6721691_7.html","Brazil deploys military aircraft against wildfires amid suspected arson, https://www.lemonde.fr/en/international/article/2024/08/26/brazil-deploys-military-aircraft-against-wildfires-amid-suspected-arson_6721694_4.html"
https://www.bbc.com,2024-08-26 05:35:24.895524,"Matthew Perry's death reveals Hollywood's ketamine 'wild west', https://www.bbc.com/news/articles/czrgp7pj4g2o","British man killed in missile strike in Ukraine, https://www.bbc.com/news/articles/c2l1py9g4r8o","Israel and Hezbollah exchange heavy fire in major escalation, https://www.bbc.com/news/articles/cq6rzvyz9p6o"
https://www.aljazeera.com,2024-08-26 05:35:24.109542,"Panic, fear as Israel orders evacuations near Gaza’s Al-Aqsa Hospital, https://www.aljazeera.com/news/liveblog/2024/8/26/israels-war-on-gaza-live-panicked-patients-flee-al-aqsa-martyrs-hospital","Five key takeaways from Nasrallah’s speech after Hezbollah-Israel attacks, https://www.aljazeera.com/news/2024/8/25/five-key-takeaways-from-nasrallahs-speech-after-hezbollah-israel-attacks","Democratic enthusiasm boosts Kamala Harris campaign with $540 million, https://www.aljazeera.com/news/2024/8/26/kamala-harris-sets-fundraising-record-with-540m-after-dnc"
https://www.economist.com,2024-08-25 05:36:51.172994,"Wildfires are getting more frequent and more devastating, https://www.economist.com/science-and-technology/2024/08/22/wildfires-are-getting-more-frequent-and-more-devastating","Countries should act faster to curb the spread of mpox, https://www.economist.com/leaders/2024/08/22/countries-should-act-faster-to-curb-the-spread-of-mpox","How to attract Indian tourists, https://www.economist.com/leaders/2024/08/22/how-to-attract-indian-tourists"
https://www.lemonde.fr/en/,2024-08-25 05:35:48.536782,"Israel launches strikes against Lebanon as Hezbollah announces attack with 'large number of drones', https://www.lemonde.fr/en/international/article/2024/08/25/israel-bombs-lebanon-says-it-is-targeting-hezbollah_6721381_4.html","Chemical weapons dump found at bottom of Baltic Sea, https://www.lemonde.fr/en/environment/article/2024/08/25/chemical-weapons-dump-found-at-bottom-of-baltic-sea_6721387_114.html","Paris 2024 Paralympic Games: Athletes light flame in Stoke Mandeville, the birthplace of Paralympism, https://www.lemonde.fr/en/sports/article/2024/08/25/paris-2024-paralympic-games-the-flame-was-lit-in-stoke-mandeville-the-birthplace-of-paralympism_6721348_9.html"
https://www.bbc.com,2024-08-25 05:35:47.804655,"Germany attack: Police arrest suspected knifeman, https://www.bbc.com/news/articles/crlr2z23ykno","Telegram CEO Pavel Durov arrested at French airport, https://www.bbc.com/news/articles/ckg2kz9kn93o","Israel strikes Hezbollah targets in Lebanon, https://www.bbc.com/news/articles/cq6rzvyz9p6o"
https://www.aljazeera.com,2024-08-25 05:35:47.029613,"Hezbollah says first phase of retaliatory attack against Israel now over, https://www.aljazeera.com/news/liveblog/2024/8/25/israels-war-on-gaza-live-israel-bombards-gaza-on-eve-of-high-level-talks","Israel attacks southern Lebanon, Hezbollah launches rockets at Israel, https://www.aljazeera.com/news/2024/8/25/israel-launches-attacks-on-lebanon-hezbollah-launches-rockets-at-israel","Hamas urges anger and condemnation over Quran burning by Israeli soldiers, https://www.aljazeera.com/news/2024/8/24/hamas-urges-anger-and-condemnation-over-quran-burning-by-israeli-soldiers"
https://www.economist.com,2024-08-24 05:37:06.581548,"Jerome Powell (almost) declares victory over inflation, https://www.economist.com/finance-and-economics/2024/08/23/jerome-powell-almost-declares-victory-over-inflation","Regulators are focusing on real AI risks over theoretical ones. Good, https://www.economist.com/leaders/2024/08/22/regulators-are-focusing-on-real-ai-risks-over-theoretical-ones-good","The trial of Lucy Letby has shocked British statisticians, https://www.economist.com/britain/2024/08/22/the-trial-of-lucy-letby-has-shocked-british-statisticians"
https://www.lemonde.fr/en/,2024-08-24 05:37:05.561919,"A new portrait of Paris in maps, from below ground to its iconic zinc roofs, https://www.lemonde.fr/en/france/visuel/2024/08/24/a-new-portrait-of-paris-in-maps-from-below-ground-to-its-iconic-zinc-roofs_6720914_7.html","Macron consults with party leaders on choice of prime minister, https://www.lemonde.fr/en/politics/article/2024/08/23/macron-consults-with-party-leaders-on-choice-of-prime-minister_6720575_5.html","Political scientist Laurence Nardon: 'Kamala Harris developed a resolutely optimistic vision of America, far removed from the apocalyptic view presented by Trump', https://www.lemonde.fr/en/opinion/article/2024/08/24/political-scientist-laurence-nardon-kamala-harris-developed-a-resolutely-optimistic-vision-of-america-far-removed-from-the-apocalyptic-view-of-the-country-presented-by-trump_6720805_23.html"
https://www.bbc.com,2024-08-24 05:37:04.838180,"Robert F Kennedy Jr suspends campaign and backs Trump, https://www.bbc.com/news/articles/cwy5ekxlwzgo","Democrats are riding high - but victory is far from certain, https://www.bbc.com/news/articles/cgl21j2py8xo","Three killed in Germany festival knife attack, https://www.bbc.com/news/articles/cd73292p1vpo"
https://www.aljazeera.com,2024-08-24 05:37:04.091296,"Gaza under Israeli attacks north and south as more mass evacuations ordered, https://www.aljazeera.com/news/liveblog/2024/8/24/israels-war-on-gaza-live-israel-attacks-as-palestinians-flee-north-gaza","US announces new round of military assistance for Ukraine, https://www.aljazeera.com/news/2024/8/23/us-announces-new-round-of-military-assistance-for-ukraine","Sudan’s warring parties agree to open two aid routes, mediators say, https://www.aljazeera.com/news/2024/8/23/sudans-warring-parties-agree-to-open-two-aid-routes-mediators-say"
https://www.economist.com,2024-08-23 05:34:34.856806,"The Kremlin is close to crushing Pokrovsk, a vital Ukrainian town, https://www.economist.com/europe/2024/08/22/the-kremlin-is-close-to-crushing-pokrovsk-a-vital-ukrainian-town","What to make of America’s topsy-turvy economy, https://www.economist.com/leaders/2024/08/22/what-to-make-of-americas-topsy-turvy-economy","Behind the surge in migrants crossing America’s northern border, https://www.economist.com/united-states/2024/08/21/behind-the-surge-in-migrants-crossing-at-americas-northern-border"
https://www.lemonde.fr/en/,2024-08-23 05:34:33.537489,"Left-wing parties meet Macron, staying united publicly despite Socialists' divisions, https://www.lemonde.fr/en/politics/article/2024/08/23/left-wing-parties-meet-macron-staying-united-publicly-despite-socialists-divisions_6720460_5.html","Kamala Harris accepts Democratic nomination to thunderous applause: 'I promise to be a president for all Americans', https://www.lemonde.fr/en/international/article/2024/08/23/kamala-harris-invites-voters-to-chart-a-new-way-forward-as-she-accepts-democratic-nomination_6720455_4.html","Paralympic Games: Club France is riding on the success of the Olympics and Paris hopes to do the same with its fan zones, https://www.lemonde.fr/en/sports/article/2024/08/23/paralympic-games-club-france-is-riding-on-the-success-of-the-olympics-and-paris-hopes-to-do-the-same-with-its-fan-zones_6720406_9.html"
https://www.bbc.com,2024-08-23 05:34:32.789198,"Four takeaways from Kamala Harris's convention speech, https://www.bbc.com/news/articles/cwy49xlx54vo","Trump lashes out as DNC attacks throw him off message, https://www.bbc.com/news/articles/czrgp30j6z1o","Kamala Harris vows 'new way forward' as she accepts Democratic nomination, https://www.bbc.com/news/live/cd9dl55wjvpt"
https://www.aljazeera.com,2024-08-23 05:34:31.900061,"Israeli negotiators reportedly in Cairo as US says truce is ‘now in sight’, https://www.aljazeera.com/news/liveblog/2024/8/23/israels-war-on-gaza-live-israelis-in-cairo-as-us-says-truce-in-sight","Key takeaways from the fourth night of the Democratic National Convention, https://www.aljazeera.com/news/2024/8/23/key-takeaways-from-the-fourth-night-of-the-democratic-national-convention","Pacific Islands leaders to meet as region faces ‘polycrisis’ of threats, https://www.aljazeera.com/news/2024/8/23/pacific-islands-leaders-to-meet-as-region-faces-polycrisis-of-threats"
https://www.economist.com,2024-08-22 05:34:26.080142,"Apple can’t do cars. Meet the Chinese tech giants that can, https://www.economist.com/business/2024/08/21/apple-cant-do-cars-meet-the-chinese-tech-giants-that-can","Mark Zuckerberg and Daniel Ek on why Europe should embrace open-source AI, https://www.economist.com/by-invitation/2024/08/21/mark-zuckerberg-and-daniel-ek-on-why-europe-should-embrace-open-source-ai","In Congo, a desperate struggle to control the deadly mpox outbreak, https://www.economist.com/middle-east-and-africa/2024/08/21/in-congo-a-desperate-struggle-to-control-the-deadly-mpox-outbreak"
https://www.lemonde.fr/en/,2024-08-22 05:34:25.073313,"What we know about mpox: Transmission, dangerosity, who's at risk, https://www.lemonde.fr/en/environment/article/2024/08/22/what-we-know-about-mpox-transmission-dangerosity-who-s-at-risk_6719639_114.html","Bill Clinton returns to DNC to praise Harris and tear into Trump: 'He mostly talks about himself', https://www.lemonde.fr/en/united-states/article/2024/08/22/bill-clinton-returns-to-dnc-to-praise-harris-and-tear-into-trump-he-mostly-talks-about-himself_6719633_133.html","US presidential election: Kamala Harris rolls out the blue carpet for influencers, https://www.lemonde.fr/en/international/article/2024/08/22/us-presidential-election-kamala-harris-rolls-out-the-blue-carpet-for-influencers_6719593_4.html"
https://www.bbc.com,2024-08-22 05:34:24.370921,"Oprah tells voters to 'choose truth' in surprise convention speech, https://www.bbc.com/news/articles/c20r9eqpynko","Democrats try to turn tables on one of their biggest weaknesses, https://www.bbc.com/news/articles/cn4738kvyvmo","'Coach Walz' rallies Democrats with personal pitch to middle America, https://www.bbc.com/news/articles/cd9dj4vdx2jo"
https://www.aljazeera.com,2024-08-22 05:34:23.625097,"New mass exodus in Gaza’s Deir el-Balah as Israel expands ground assault, https://www.aljazeera.com/news/liveblog/2024/8/22/israels-war-on-gaza-live-mass-exodus-as-israel-expands-ground-invasion","‘The honour of my life’: Walz accepts VP nomination at DNC, https://www.aljazeera.com/news/2024/8/22/the-honour-of-my-life-walz-accepts-vp-nomination-at-dnc","Robert F Kennedy Jr to drop US presidential bid, back Trump, reports say, https://www.aljazeera.com/news/2024/8/22/robert-f-kennedy-jr-to-drop-us-presidential-bid-back-trump-reports-say"
https://www.economist.com,2024-08-21 05:34:31.173004,"Kamala Harris’s cost-of-living plan will end in failure, https://www.economist.com/finance-and-economics/2024/08/20/kamala-harriss-cost-of-living-plan-will-end-in-failure","The Middle East’s bizarre waiting game: ceasefire or Armageddon?, https://www.economist.com/middle-east-and-africa/2024/08/20/the-middle-easts-bizarre-waiting-game-ceasefire-or-armageddon","Indian tourists are conquering the world, https://www.economist.com/international/2024/08/20/indian-tourists-are-conquering-the-world"
https://www.lemonde.fr/en/,2024-08-21 05:34:30.085570,"Africa, the new frontline between the West and Russia, https://www.lemonde.fr/en/international/article/2024/08/21/africa-the-new-frontline-between-the-west-and-russia_6719110_4.html","'Hope is making a comeback,' Michelle Obama tells DNC attendees to support Harris, https://www.lemonde.fr/en/united-states/article/2024/08/21/hope-is-making-a-comeback-michelle-obama-tells-dnc-attendees-in-chicago-to-support-harris_6719106_133.html","Democratic convention opens with Biden's farewell: 'I love the job, but I love my country more', https://www.lemonde.fr/en/international/article/2024/08/20/democratic-convention-opens-with-biden-s-farewell-i-love-the-job-but-i-love-my-country-more_6718714_4.html"
https://www.bbc.com,2024-08-21 05:34:28.851139,"'Who's telling Trump he might be seeking one of those black jobs?', https://www.bbc.com/news/videos/czjymn7rxnzo","Obamas mock Trump over 'black jobs' and crowd sizes, https://www.bbc.com/news/videos/cvgep7d752jo","Obamas call on Americans to back ‘new chapter’ with Harris, https://www.bbc.com/news/live/czrgvx20rznt"
https://www.aljazeera.com,2024-08-21 05:34:27.992370,"Truce deal still elusive as Israeli forces kill 52 Palestinians across Gaza, https://www.aljazeera.com/news/liveblog/2024/8/21/israels-war-on-gaza-live-israel-bombards-gaza-lebanon-us-says-deal-near","‘Let’s get to work!’: Barack Obama takes stage for Kamala Harris at DNC, https://www.aljazeera.com/news/2024/8/21/barack-obama-to-speak-at-dnc-some-republicans-come-out-for-kamala-harris","Pro-Palestinian protesters clash with US police on second night of DNC, https://www.aljazeera.com/news/2024/8/21/pro-palestinian-protesters-clash-with-police-on-second-night-of-dnc"
https://www.economist.com,2024-08-20 05:34:57.215247,"The mysterious middle-men helping Russia’s war machine, https://www.economist.com/europe/2024/08/19/the-mysterious-middle-men-helping-russias-war-machine","Free exchange: Artificial intelligence is losing hype, https://www.economist.com/finance-and-economics/2024/08/19/artificial-intelligence-is-losing-hype","Good news for Kamala Harris on third-party candidates, https://www.economist.com/united-states/2024/08/19/good-news-for-kamala-harris-on-third-party-candidates"
https://www.lemonde.fr/en/,2024-08-20 05:34:56.191244,"Channel crossings are becoming increasingly deadly for migrants, https://www.lemonde.fr/en/europe/article/2024/08/20/channel-crossings-are-becoming-increasingly-deadly-for-migrants_6718563_143.html","Kamala Harris makes surprise appearance at DNC as party says goodbye to Biden, https://www.lemonde.fr/en/international/article/2024/08/20/kamala-harris-makes-surprise-appearance-at-dnc-as-party-says-goodbye-to-biden_6718597_4.html","Kylian Mbappé counterattacks to reclaim unpaid sums from PSG, https://www.lemonde.fr/en/france/article/2024/08/20/kylian-mbappe-counterattacks-to-reclaim-unpaid-sums-from-psg_6718633_7.html"
https://www.bbc.com,2024-08-20 05:34:55.323515,"Hillary Clinton says it's time Kamala Harris broke 'glass ceiling', https://www.bbc.com/news/articles/ce317d27l7zo","Iran hacked Trump campaign, US intelligence confirms, https://www.bbc.com/news/articles/cwy7kvkk2dwo","'America, I gave my best to you': Emotional Biden embraces Kamala Harris after farewell speech, https://www.bbc.com/news/live/c5y36r3zplvt"
